{
  "schema_version": 1,
  "job_id": "book_0041-pt-BR-translation",
  "work_id": "book_0041",
  "edition_id": "book_0041:pt-BR:1",
  "book_code": "book_0041",
  "locale": "pt-BR",
  "status": "IN_PROGRESS",
  "expected_block_count": 101,
  "last_contiguous_sequence": 26,
  "next_sequence": 27,
  "generated_at": "2026-07-30T02:35:43.593155+00:00",
  "blocks": [
    {"sequence":1,"block_id":"book_0041:pt-BR:1:p1:c1:b1","file_name":"p1_c01_en_chunk_01_pt_br.md","content_sha256":"5d67733742e35f840753ab84fc381b13135d1b76933132e625c643550b16ed52","size_bytes":7374,"status":"READY","version":1,"source_block_id":"book_0041:en-GB:1:p1:c1:b1","updated_at":"2026-07-30T01:03:33.427188+00:00"},
    {"sequence":2,"block_id":"book_0041:pt-BR:1:p1:c1:b2","file_name":"p1_c01_en_chunk_02_pt_br.md","content_sha256":"8c9babb5b7916188afc6158c69bb30660b55ee7e7b885b82007ca13ff8132075","size_bytes":6493,"status":"READY","version":1,"source_block_id":"book_0041:en-GB:1:p1:c1:b2","updated_at":"2026-07-30T01:04:27.091189+00:00"},
    {"sequence":3,"block_id":"book_0041:pt-BR:1:p1:c1:b3","file_name":"p1_c01_en_chunk_03_pt_br.md","content_sha256":"e4bfd4054732b6a3e05d4cfd63cce5ca21db1c127c53a72ca33f48888965da78","size_bytes":6689,"status":"READY","version":1,"source_block_id":"book_0041:en-GB:1:p1:c1:b3","updated_at":"2026-07-30T01:05:22.491190+00:00"},
    {"sequence":4,"block_id":"book_0041:pt-BR:1:p1:c1:b4","file_name":"p1_c01_en_chunk_04_pt_br.md","content_sha256":"ad998f7e343d4a390ec3c19132cccb898c8ed55c940ec3d26967e3ea83c95074","size_bytes":7125,"status":"READY","version":1,"source_block_id":"book_0041:en-GB:1:p1:c1:b4","updated_at":"2026-07-30T01:06:23.763191+00:00"},
    {"sequence":5,"block_id":"book_0041:pt-BR:1:p1:c1:b5","file_name":"p1_c01_en_chunk_05_pt_br.md","content_sha256":"9474dc323096b9e5d573a547fcde143d07fa57cbc993b564e52a83a1de4988c0","size_bytes":6852,"status":"READY","version":1,"source_block_id":"book_0041:en-GB:1:p1:c1:b5","updated_at":"2026-07-30T01:07:19.519192+00:00"},
    {"sequence":6,"block_id":"book_0041:pt-BR:1:p1:c1:b6","file_name":"p1_c01_en_chunk_06_pt_br.md","content_sha256":"fe1ee0f73539eb0546d480fd15b481bd92599e7222fd66b1833a369c40fa81e6","size_bytes":2018,"status":"READY","version":1,"source_block_id":"book_0041:en-GB:1:p1:c1:b6","updated_at":"2026-07-30T01:07:41.091193+00:00"},
    {"sequence":7,"block_id":"book_0041:pt-BR:1:p1:c2:b1","file_name":"p1_c02_en_chunk_01_pt_br.md","content_sha256":"d6e38725cf2f32231e93380d92519cf2fb0bd26e6f68efd00791f23ef3346002","size_bytes":7253,"status":"READY","version":1,"source_block_id":"book_0041:en-GB:1:p1:c2:b1","updated_at":"2026-07-30T01:08:53.879194+00:00"},
    {"sequence":8,"block_id":"book_0041:pt-BR:1:p1:c2:b2","file_name":"p1_c02_en_chunk_02_pt_br.md","content_sha256":"f88d7ab39067d3f1f83f2e7d80dc421da93adb25afa178e2643e1c52ec7967dd","size_bytes":6695,"status":"READY","version":1,"source_block_id":"book_0041:en-GB:1:p1:c2:b2","updated_at":"2026-07-30T01:09:54.423195+00:00"},
    {"sequence":9,"block_id":"book_0041:pt-BR:1:p1:c2:b3","file_name":"p1_c02_en_chunk_03_pt_br.md","content_sha256":"11e573b2805a514d1a2216a8d0f1cfc1464e892402d7cf11ef10ebeeb76f156e","size_bytes":3165,"status":"READY","version":1,"source_block_id":"book_0041:en-GB:1:p1:c2:b3","updated_at":"2026-07-30T01:10:23.459196+00:00"},
    {"sequence":10,"block_id":"book_0041:pt-BR:1:p1:c3:b1","file_name":"p1_c03_en_chunk_01_pt_br.md","content_sha256":"f879159d9c51e95032fcf02e1dfefc0423fe074669c36fa2af688d4aa8a0192e","size_bytes":7063,"status":"READY","version":1,"source_block_id":"book_0041:en-GB:1:p1:c3:b1","updated_at":"2026-07-30T01:11:34.067197+00:00"},
    {"sequence":11,"block_id":"book_0041:pt-BR:1:p1:c3:b2","file_name":"p1_c03_en_chunk_02_pt_br.md","content_sha256":"f2afa0a3e92e12a9195f9f0dd055f42cfd04141e95b3e8405acf271d5bc1b0e2","size_bytes":6465,"status":"READY","version":1,"source_block_id":"book_0041:en-GB:1:p1:c3:b2","updated_at":"2026-07-30T01:12:32.155198+00:00"},
    {"sequence":12,"block_id":"book_0041:pt-BR:1:p1:c3:b3","file_name":"p1_c03_en_chunk_03_pt_br.md","content_sha256":"660ea7a26bd5b244febcfdc6cb20bf7e71bdfc933ac985262e16b7b1c8439303","size_bytes":3517,"status":"READY","version":1,"source_block_id":"book_0041:en-GB:1:p1:c3:b3","updated_at":"2026-07-30T01:12:58.419199+00:00"},
    {"sequence":13,"block_id":"book_0041:pt-BR:1:p1:c4:b1","file_name":"p1_c04_en_chunk_01_pt_br.md","content_sha256":"b7c9797b35953302d50c1be899b2cde50e91c6173a92de7b9718884d54b4a760","size_bytes":6688,"status":"READY","version":1,"source_block_id":"book_0041:en-GB:1:p1:c4:b1","updated_at":"2026-07-30T01:14:01.207200+00:00"},
    {"sequence":14,"block_id":"book_0041:pt-BR:1:p1:c4:b2","file_name":"p1_c04_en_chunk_02_pt_br.md","content_sha256":"fb642ddcf32685bb248f75cdb76d5dbf8f6f822664281132dd3e7b2710870eef","size_bytes":7511,"status":"READY","version":1,"source_block_id":"book_0041:en-GB:1:p1:c4:b2","updated_at":"2026-07-30T01:14:54.927201+00:00"},
    {"sequence":15,"block_id":"book_0041:pt-BR:1:p1:c4:b3","file_name":"p1_c04_en_chunk_03_pt_br.md","content_sha256":"5d65ff034c3e3cbe909d9ed2a8da67995e15555e2a83465ebcc86fd9926a105f","size_bytes":6886,"status":"READY","version":1,"source_block_id":"book_0041:en-GB:1:p1:c4:b3","updated_at":"2026-07-30T01:15:41.823202+00:00"},
    {"sequence":16,"block_id":"book_0041:pt-BR:1:p1:c5:b1","file_name":"p1_c05_en_chunk_01_pt_br.md","content_sha256":"3e643fd8c46fe7f459891c56c34adda803e14502c0d91bf0fe1ab8481b4750cc","size_bytes":7291,"status":"READY","version":1,"source_block_id":"book_0041:en-GB:1:p1:c5:b1","updated_at":"2026-07-30T01:16:41.427203+00:00"},
    {"sequence":17,"block_id":"book_0041:pt-BR:1:p1:c5:b2","file_name":"p1_c05_en_chunk_02_pt_br.md","content_sha256":"95fce327f26f5719956610d9d5aaaa31585f07eafa666fe7570f0d618d56e52c","size_bytes":6062,"status":"READY","version":1,"source_block_id":"book_0041:en-GB:1:p1:c5:b2","updated_at":"2026-07-30T01:17:27.963204+00:00"},
    {"sequence":18,"block_id":"book_0041:pt-BR:1:p1:c5:b3","file_name":"p1_c05_en_chunk_03_pt_br.md","content_sha256":"1eed127b063ef528bdfd845c86d8f9adde44f0c9993e0d972f7ac576b176978c","size_bytes":6794,"status":"READY","version":1,"source_block_id":"book_0041:en-GB:1:p1:c5:b3","updated_at":"2026-07-30T01:18:23.719205+00:00"},
    {"sequence":19,"block_id":"book_0041:pt-BR:1:p1:c5:b4","file_name":"p1_c05_en_chunk_04_pt_br.md","content_sha256":"2c8479f0202b6acb5e0f2d8f3126dbf6b5f2f2d915ff208b6db806020ed6ad21","size_bytes":7514,"status":"READY","version":1,"source_block_id":"book_0041:en-GB:1:p1:c5:b4","updated_at":"2026-07-30T01:19:19.467206+00:00"},
    {"sequence":20,"block_id":"book_0041:pt-BR:1:p1:c5:b5","file_name":"p1_c05_en_chunk_05_pt_br.md","content_sha256":"ecb4410ac76c3b4c229e6662a991ef350496ff3ee7157f8323f8aef87aa9d9f2","size_bytes":2677,"status":"READY","version":1,"source_block_id":"book_0041:en-GB:1:p1:c5:b5","updated_at":"2026-07-30T01:19:45.379207+00:00"},
    {"sequence":21,"block_id":"book_0041:pt-BR:1:p1:c6:b1","file_name":"p1_c06_en_chunk_01_pt_br.md","content_sha256":"5c6f638ff2647e8e47358f3b03f313949a287131342e097036b6ed0f42fa7588","size_bytes":6805,"status":"READY","version":1,"source_block_id":"book_0041:en-GB:1:p1:c6:b1","updated_at":"2026-07-30T01:20:50.079208+00:00"},
    {"sequence":22,"block_id":"book_0041:pt-BR:1:p1:c6:b2","file_name":"p1_c06_en_chunk_02_pt_br.md","content_sha256":"07335b46d06d2b8cb703ebd7756ceb53079d71ffd0a5ec36def3fe2a9c69f71e","size_bytes":4319,"status":"READY","version":1,"source_block_id":"book_0041:en-GB:1:p1:c6:b2","updated_at":"2026-07-30T01:21:21.795209+00:00"},
    {"sequence":23,"block_id":"book_0041:pt-BR:1:p1:c7:b1","file_name":"p1_c07_en_chunk_01_pt_br.md","content_sha256":"56781759ea40a606fbc22587e518a44039249ff2704100a32a5aa240451c763d","size_bytes":6391,"status":"READY","version":1,"source_block_id":"book_0041:en-GB:1:p1:c7:b1","updated_at":"2026-07-30T01:22:11.507210+00:00"},
    {"sequence":24,"block_id":"book_0041:pt-BR:1:p1:c7:b2","file_name":"p1_c07_en_chunk_02_pt_br.md","content_sha256":"7d5a0c33fe1aa7673e1468c3097c82a4848b747fa57dc8d60486d4a32d6b7d4f","size_bytes":7054,"status":"READY","version":1,"source_block_id":"book_0041:en-GB:1:p1:c7:b2","updated_at":"2026-07-30T01:23:05.503211+00:00"},
    {"sequence":25,"block_id":"book_0041:pt-BR:1:p1:c7:b3","file_name":"p1_c07_en_chunk_03_pt_br.md","content_sha256":"e0a407f7fa29138a85b2b19ea984b2b62d22f7bcd17281d3c8654465374856bd","size_bytes":6728,"status":"READY","version":1,"source_block_id":"book_0041:en-GB:1:p1:c7:b3","updated_at":"2026-07-30T01:23:59.979212+00:00"},
    {"sequence":26,"block_id":"book_0041:pt-BR:1:p1:c7:b4","file_name":"p1_c07_en_chunk_04_pt_br.md","content_sha256":"8ddd7c5372223264f9147fb1bb2d29ca7819045877ae31d1031ee00242d84fbd","size_bytes":3772,"status":"READY","version":1,"source_block_id":"book_0041:en-GB:1:p1:c7:b4","updated_at":"2026-07-30T01:24:36.771213+00:00"}
  ],
  "manifest_sha256": "f616d5419968676c1b562978b57fee68f1be950a57175b4db2f0988be4f85092"
}
